Protocol_ID,Protocol_Name,Condition_ID,Phenotype_ID,Modality_ID,Device_ID_if_specific,On_Label_vs_Off_Label,Evidence_Grade,Evidence_Summary,Target_Region,Laterality,Frequency_Hz,Intensity,Session_Duration,Sessions_per_Week,Total_Course,Coil_or_Electrode_Placement,Monitoring_Requirements,Contraindication_Check_Required,Adverse_Event_Monitoring,Escalation_or_Adjustment_Rules,Patient_Facing_Allowed,Clinician_Review_Required,Source_URL_Primary,Source_URL_Secondary,Notes,Review_Status
PRO-049,rTMS M1 / DLPFC for SCI-Related Central Pain,CON-008,,MOD-001,,Off-label,EV-B,"IFCN Level B (Lefaucheur et al. 2017 PMID 27866120). Meta-analysis Nardone et al. 2017 (Spinal Cord): HF-rTMS M1 significantly reduces neuropathic pain VAS in SCI (SMD=-0.61). ~15 RCTs.",Contralateral M1 (leg representation area at Cz/Pz) or left DLPFC for emotional pain component,Contralateral to pain,10 Hz excitatory,80–110% RMT,20 minutes (~2000 pulses),5 per week,10–20 sessions; maintenance schedule considered after response,Figure-8 coil over contralateral M1 leg area (Cz-Pz region) or F3 DLPFC,VAS/NRS pain pre/post session; SCIM (Spinal Cord Independence Measure); PHQ-9 for depression comorbidity; adverse event log,Yes,Headache; scalp discomfort; transient pain change; spasm exacerbation possible — monitor,If <30% VAS improvement after 10 sessions: switch target to DLPFC or add DLPFC sequential,No (off-label),Yes,https://pubmed.ncbi.nlm.nih.gov/27866120/,https://pubmed.ncbi.nlm.nih.gov/28332488/,"IFCN Level B for central pain including SCI. Leg area of M1 is somatotopically appropriate for lower-limb SCI pain. Condition slug CON-008 (chronic pain) used as closest; spinal-cord-injury-pain JS slug has no CSV CON equivalent.",Unreviewed
PRO-050,tDCS Anodal Left Broca for Post-Stroke Aphasia,CON-015,,MOD-003,,Off-label,EV-B,"IFCN Level B (Lefaucheur et al. 2017 PMID 27866120). ~12 RCTs. Walker et al. 2021 meta-analysis (Neuropsychol Rehabil): anodal tDCS left hemisphere + speech therapy superior to sham+therapy (g=0.39, p=0.003).",Left hemisphere Broca's area (F3/inferior frontal gyrus) anode; right homolog or supraorbital cathode,Left (ipsilesional),0 (DC),1–2 mA,20 minutes,5 per week,10–20 sessions combined with speech-language therapy,Anode over left inferior frontal gyrus (F3 / Broca area); cathode right homolog (F4) or right supraorbital,WAB (Western Aphasia Battery) or BNT at baseline/post; session-by-session language task performance; skin inspection,Yes,Skin irritation; tingling; headache; electrode placement critical — speech pathologist co-delivery,If no naming improvement after 10 sessions: reassess lesion overlap with stimulation site; consider HD-tDCS,No (off-label),Yes — speech-language pathologist + neurologist required,https://pubmed.ncbi.nlm.nih.gov/27866120/,https://pubmed.ncbi.nlm.nih.gov/33197261/,"IFCN Level B. tDCS must be delivered concurrent with speech-language therapy for effect (no stand-alone benefit). Ipsilesional anodal is most-studied; contralesional cathodal also applied. JS conditionId post-stroke-aphasia exists but has only rTMS protocol (p-psa-001) — this CSV entry covers tDCS/aphasia gap.",Unreviewed
PRO-051,HRV Biofeedback for Generalized Anxiety Disorder,CON-004,,MOD-011,,Off-label / Evidence-supported,EV-B,"Grade B. ~20 RCTs. Lehrer et al. 2020 meta-analysis (Appl Psychophysiol Biofeedback): significant GAD-7 and HRV-LF improvement. Goessl et al. 2017 meta-analysis (Psychol Med): g=0.81 anxiety reduction. Resonance frequency breathing enhances vagal tone.",Autonomic nervous system (cardiac) via resonance frequency breathing + HRV biofeedback,N/A (systemic autonomic),Resonance frequency (~0.1 Hz breathing / 6 breaths per minute),N/A,20 minutes per session,2–3 clinic sessions + daily home practice (5–10 min),6–10 clinic sessions; ongoing home practice,Heart rate sensor (chest strap or fingertip PPG); biofeedback display; breathing pacer,GAD-7 biweekly; HRV frequency domain metrics (LF/HF) at baseline and post-course; sleep diary,No,No significant AEs; caution in severe cardiac arrhythmia,Identify individual resonance frequency (5–7 breaths/min range); progress home practice by session 3; reassess GAD-7 at session 6,Yes (home practice component),No (adjunctive; wellness level),https://pubmed.ncbi.nlm.nih.gov/28286374/,https://pubmed.ncbi.nlm.nih.gov/32430034/,"Goessl 2017 meta-analysis (Psychol Med, g=0.81) specifically for anxiety disorders. Resonance frequency identification is essential first step. Distinguished from PRO-032 (which targets stress/depression primarily). Note: HRV biofeedback is adjunctive — not suitable as sole treatment for severe GAD. Pair with CBT for best outcomes.",Unreviewed
PRO-052,rTMS for Bipolar Depression (Low-Frequency Right-Sided Protocol),CON-006,,MOD-001,,Off-label,EV-B,"IFCN Level B mention (Lefaucheur 2017). Multiple small RCTs: Dell'Osso et al. 2009 (Bipolar Disord) n=11; Praharaj et al. 2011 meta-analysis; ~15 RCTs. Right-sided inhibitory preferred over left excitatory to minimize mania switch risk.",Right DLPFC (inhibitory),Right,1 Hz inhibitory,100% RMT,20 minutes (~1200 pulses),5 per week,15–20 sessions; monitor for mood elevation throughout,Figure-8 coil at F4 (right DLPFC),MADRS or HAMD weekly; Young Mania Rating Scale (YMRS) weekly (switch monitoring); PHQ-9; adverse event log; mood stabilizer level monitoring,Yes,Headache; scalp discomfort; rare: hypomania/mania switch — monitor YMRS weekly; agitation,Stop immediately if YMRS >12 or clear manic symptoms; always co-administer mood stabilizer,No (off-label),Yes — psychiatrist mandatory for mood switch monitoring,https://pubmed.ncbi.nlm.nih.gov/25034472/,https://pubmed.ncbi.nlm.nih.gov/19811529/,"Right-sided inhibitory protocol preferred for BD-depression to minimise mania switch (Dell'Osso 2009 PMID 19811529; Praharaj 2011). Left HF-rTMS has higher switch risk. Current manic or mixed episode is absolute contraindication. Condition slug CON-006 (insomnia) mismatch flagged — BD-Depression has no CON in conditions.csv; bipolar-depression JS slug exists. Use JS conditionId bipolar-depression.",Unreviewed
PRO-053,PBM Whole-Body + LLLT Tender-Point for Fibromyalgia,CON-008,,MOD-012,,Off-label,EV-B,"Grade B. Yeh 2019 meta-analysis (9 RCTs, N=325) SMD=1.18 for pain, SMD=1.16 FIQ. Son 2025 umbrella review: moderate certainty for fatigue (eSMD=1.25). Ribeiro 2023 (N=90, PBMT+sMF, 9 sessions) positive. Navarro-Ledesma 2022 whole-body protocol reproducible.",Whole-body + local tender points (LED/laser cluster),Bilateral / systemic,"Continuous-wave 660 nm + 850 nm (Navarro-Ledesma 2022 whole-body); 808–904 nm local","25.2 J/cm² per site (Navarro-Ledesma 2022); LLLT tender-point 6 J (de Carvalho 2012)",20 min whole-body (Navarro-Ledesma 2022); ~50 min LLLT + exercise (de Carvalho 2012),3 (Navarro-Ledesma 2022),12 sessions over 4 wk,Whole-body LED bed and/or local laser cluster over tender points per ACR criteria,FIQ and pain VAS weekly; tender-point count; fatigue scale,Yes,Transient erythema; eye-protection required; rare photosensitivity,If <20% FIQ reduction after 6 sessions: reassess dosing and tender-point selection,Yes (with clinician supervision),Yes,https://pubmed.ncbi.nlm.nih.gov/31747571/,https://pubmed.ncbi.nlm.nih.gov/36301348/,"Yeh 2019 meta-analysis (PMID 31747571) is anchor — 9 RCTs N=325 large effects. Verify dose/schedule per specific device used. Pair with graded exercise. All patients require eye protection during illumination.",Unreviewed
PRO-054,tcVNS Cervical Vagus for PTSD (Bremner Protocol),CON-007,,MOD-006,,Off-label,EV-C,"Grade C. Bremner 2021 RCT (N=20, tcVNS 3 mo twice daily) 31% greater PCL reduction vs sham (p=0.013). Gurel 2020 (N=25) sympathetic attenuation. Benzouak 2025 systematic review: very low certainty overall. Distinct from auricular taVNS (p-ptsd-002) — cervical tcVNS montage.",Cervical (transcutaneous) vagus — gammaCore-style neck placement; OR left cymba conchae (auricular variant),Left (cervical) or left auricular,"30 Hz pulse, 250 µs pulse width (Zhang 2025 protocol); 25 Hz common alternative","Start 0.4 V, titrate by 0.4 V to tingle threshold (Zhang 2025)","2 h × 2/day preoperative (Zhang 2025); open-label home use 2×/day (Bremner 2021)","Acute/preventive: 4 post-op days, 2/day (Zhang 2025); chronic home use twice daily × 12 wk (Bremner 2021)","12 weeks twice daily (Bremner 2021); 8 post-op sessions (Zhang 2025)",Cervical neck placement (gammaCore); auricular variant at left cymba concha,PCL-5 biweekly; heart rate during session; IL-6 stress response if available,Yes,Throat discomfort; voice alteration; skin erythema; rare vasovagal response,If no PCL-5 reduction after 6 weeks: review adherence and placement; consider auricular variant,Yes (home-use tcVNS) — clinician-led titration,Yes,https://pubmed.ncbi.nlm.nih.gov/33262253/,https://pubmed.ncbi.nlm.nih.gov/32440524/,"Bremner 2021 PMID 33262253 primary (N=20 pilot, DOI 10.1016/j.jadr.2020.100079). Benzouak 2025 notes very low certainty — Grade C. Distinct from auricular taVNS (p-ptsd-002). `verify`: auricular-specific RCTs mostly pilot. Review_Status=Unreviewed.",Unreviewed
PRO-055,HRV Resonance Frequency Biofeedback for PTSD,CON-007,,MOD-011,,Off-label,EV-C,"Grade C (subgroup-only main effect). Pyne 2019 WAR study (N=342 National Guard) largest RCT; overall NS but HRVB arm lowered PCL in older soldiers (ES -0.97 to -1.03). Schuman 2022 pilot reduced Cluster B intrusion symptoms + depression. Burch 2020 (N=34 cancer survivors) reduced PTSD-spectrum symptoms.",Autonomic nervous system (cardiac) via resonance frequency breathing,N/A (systemic autonomic),Resonance frequency (~0.1 Hz / ~6 breaths/min),N/A (autonomic training),15–20 min per session,3–5 per week (varies),6–12 weekly clinical sessions + daily home practice,HRV biofeedback display + breathing pacer; chest-strap or fingertip PPG,PCL-5 every 2 weeks; HRV LF/HF at baseline and post-course; daily HRV logs,No,No significant AEs; caution in severe cardiac arrhythmia,Identify individual resonance frequency (5–7 breaths/min); escalate to weekly clinic sessions if home adherence <50%,Yes (home practice component),No (adjunctive; wellness level),https://pubmed.ncbi.nlm.nih.gov/30020511/,https://pubmed.ncbi.nlm.nih.gov/36331685/,"Pyne 2019 PMID 30020511 (Mil Med, DOI 10.1093/milmed/usy171) main RCT — subgroup effect only, hence Grade C. `verify`: session counts vary across studies. Distinct from PRO-051 (GAD — Grade B). Adjunctive to trauma-focused CBT; not a sole therapy for severe PTSD.",Unreviewed
PRO-056,taVNS / tcVNS for Chronic Pain (Auricular and Cervical),CON-008,,MOD-006,,Off-label,EV-B,"Grade B. Costa 2024 meta (k=15 RCTs) ES 0.41 (95% CI 0.17–0.66) favoring tVNS for chronic pain; auricular subgroup ES=0.42 (k=8). Heterogeneous device/parameters — stratify by pain phenotype before clinical rollout.",Left cymba conchae (auricular) OR cervical tcVNS,Left,"25 Hz most common (verify individual RCT)","NCT opaque on intensity (Costa 2024 pooled k=15 trials with heterogeneous mA; checked NCT04777500/NCT04503889/NCT06689345 arm descriptions, none expose mA — verify against published sub-protocol papers)","NCT06689345 = 30 min; other underlying NCTs opaque on duration — verify per sub-protocol","NCT opaque on sessions/wk — verify per sub-protocol","NCT04777500 = 4 weeks total; other underlying NCTs opaque on total — verify per sub-protocol",Auricular left cymba concha OR cervical gammaCore-style,NRS/VAS pain weekly; BPI (Brief Pain Inventory) monthly; session HR monitoring,Yes,Ear discomfort; skin erythema; cough reflex; rare vasovagal response,If <20% NRS reduction after 4 weeks: review placement and escalate duration; consider alternative VNS target,Yes (home-use auricular) — clinician-led titration,Yes,https://pubmed.ncbi.nlm.nih.gov/39131814/,https://clinicaltrials.gov/study/NCT04777500 ; https://clinicaltrials.gov/study/NCT04503889 ; https://clinicaltrials.gov/study/NCT06689345,"Costa 2024 PMID 39131814 (Pain Reports DOI 10.1097/PR9.0000000000001171) meta-analysis anchor. Cross-checked 3 underlying NCTs via ClinicalTrials.gov v2 API: NCT04777500 (fibromyalgia, 4-wk taVNS), NCT04503889 (cymba conchae bilateral, ECO2-TENS device), NCT06689345 (30 min taVNS for chronic pain + post-COVID). NCT records opaque on mA intensity — verify flag retained: check published sub-protocol papers. Recommend stratifying by pain phenotype (neuropathic vs nociplastic) before rollout.",Unreviewed
